{
  "schema_version": 1,
  "episode_id": "EP-20260919-002",
  "source_type": "user_feedback",
  "revision": {
    "source": "working tree on ceb639f56c940939c36c745e739c237167048159 (PLAN-PRODUCT-001 inventory)",
    "base": "ceb639f56c940939c36c745e739c237167048159"
  },
  "run": {
    "run_id": "product-inventory-001",
    "started_at": "2026-09-19T10:31:00Z",
    "ended_at": "2026-09-19T10:40:00Z",
    "status": "complete"
  },
  "claims": [
    {
      "claim_id": "C1",
      "claim": "产品完善路线已落盘为 PLAN-PRODUCT-001，含架构结论、已拍板事项、已做/没做与后续顺序",
      "status": "verified",
      "check": "test -f records/plans/PLAN-PRODUCT-001.md && python3.12 tools/lab/validate.py artifacts",
      "evidence_ref": "records/plans/PLAN-PRODUCT-001.md"
    },
    {
      "claim_id": "C2",
      "claim": "第一次噪声底 live 对照仍未闭合",
      "status": "verified",
      "check": "ls records/improvement/evaluations records/improvement/comparisons records/improvement/releases 2>/dev/null; PLAN-LOOP-SMOKE-001 T05 status",
      "evidence_ref": "no evaluation/comparison/release artifacts; PLAN-LOOP-SMOKE-001 T05 阻塞"
    }
  ],
  "evidence": [
    {
      "evidence_id": "E1",
      "kind": "plan",
      "ref": "records/plans/PLAN-PRODUCT-001.md"
    },
    {
      "evidence_id": "E2",
      "kind": "plan",
      "ref": "records/plans/PLAN-LOOP-SMOKE-001.md"
    },
    {
      "evidence_id": "E3",
      "kind": "episode",
      "ref": "records/episodes/2026-09-19/EP-20260919-001.json"
    }
  ],
  "objective": "盘点已做与未做，把架构评审结论与产品完善顺序写成可回写计划，不声称闭环已跑通",
  "outcome": "accepted",
  "signals": [
    {
      "kind": "product_decision",
      "value": "product; generic hosts; close loop ASAP as public noise floor; reliability and audit both required",
      "evidence_ref": "PLAN-PRODUCT-001 已拍板"
    },
    {
      "kind": "architecture_verdict",
      "value": "keep method plugin; do not rebuild runtime; FTS5 not vectors; 14 roles optional not default pipeline",
      "evidence_ref": "PLAN-PRODUCT-001 架构结论"
    },
    {
      "kind": "no_independent_review_gate",
      "value": "supervisor inventory session; review_roundtrips=[] means not run",
      "evidence_ref": "review_roundtrips"
    }
  ],
  "feedback_summary": "用户要已做/没做清单、进一步完善计划，并把此前架构评审与四条产品决定记录下来。本会话写入 PLAN-PRODUCT-001 与本 episode；不提交、不探测、不 promote。",
  "agentflow_version": "0.8.1",
  "host": "other",
  "provenance": {
    "carrier": "cursor-session",
    "sanitized": true
  },
  "redactions": [],
  "occurred_at": "2026-09-19T10:40:00Z",
  "review_roundtrips": []
}
