{
  "schema_version": 1,
  "episode_id": "EP-2026-10-12-005",
  "source_type": "user_feedback",
  "revision": {
    "source": "agentflows working tree（内容质量批：四批结构改造后活面语义复核与修正；随本批提交）",
    "base": "cc03012"
  },
  "run": {
    "run_id": "session-20261012-content-quality",
    "started_at": "2026-10-12T18:30:00+08:00",
    "ended_at": "2026-10-12T18:34:00+08:00",
    "status": "complete"
  },
  "objective": "按用户「整体内容质量检查，把无效或者需要更新的都处理掉」：对四批结构改造后的全部活文档做语义复核，修正描述与现状不符的过时内容（机器门只覆盖断链与 token，语义缺口漏网）。",
  "outcome": "accepted",
  "signals": [
    {
      "kind": "user_feedback_quote",
      "value": "整体的内容质量检查一下，因为我改的东西比较多，把无效或者需要更新的都处理了"
    },
    {
      "kind": "acceptance_output",
      "value": "validate.py all 9×PASS；unittest 124 OK；活文档旧根裸提法与过时状态词 grep 零残留（历史时点证据按原则保留）"
    },
    {
      "kind": "measurement",
      "value": "none (method-level change, no instrumented business task)"
    }
  ],
  "claims": [
    {
      "claim_id": "C1",
      "claim": "产品链三份（method-spec / acceptance-matrix / product-design）+ proposal + product README 的过时内容修正：S6 落点、S7/S10 停用裁撤状态、S8 检查清单、S9 排除口径、S12/S13、矩阵台账引用与标尺",
      "status": "verified",
      "check": "doc_chain + docs 检查 PASS；逐项 grep 复核",
      "evidence_ref": "E1"
    },
    {
      "claim_id": "C2",
      "claim": "边界文档对外口径重写为现状（人工闭环、业务切片裁撤、仪器存量）；system-guide 与两份 PLAN 的路径与落点标注同步；index 重复段删除",
      "status": "verified",
      "check": "全量门绿；index 迁移记录无重复",
      "evidence_ref": "E1"
    }
  ],
  "evidence": [
    {
      "evidence_id": "E1",
      "kind": "books",
      "ref": "docs/issues/ISS-2026-10-12-重构后内容质量清扫.md"
    }
  ],
  "review_roundtrips": [],
  "feedback_summary": "用户「内容质量检查」驱动：机器门之外的语义层过时内容全量清理（约 10 份活文档、60+ 处修正）；历史时点证据（事实台账、CHANGELOG、episodes、ISSUE 正文）按原则不回写；measurement: none",
  "agentflow_version": "0.10.0",
  "host": "other",
  "provenance": {
    "carrier": "WorkBuddy 会话（主对话直改）",
    "sanitized": true
  },
  "redactions": [],
  "occurred_at": "2026-10-12T18:34:00+08:00"
}
