{
  "schema_version": 1,
  "episode_id": "EP-2026-10-12-007",
  "source_type": "user_feedback",
  "revision": {
    "source": "agentflows working tree（评测装置裁撤批：evals 整线删除，设计知识先吸收进 design-decisions §3；随本批提交）",
    "base": "cc03012"
  },
  "run": {
    "run_id": "session-20261012-eval-removal",
    "started_at": "2026-10-12T18:41:00+08:00",
    "ended_at": "2026-10-12T18:46:00+08:00",
    "status": "complete"
  },
  "objective": "按用户「evals 删除吧，删除之前先把精华看看能吸收到那个文档里面」：把评测装置的设计知识（用例维度、度量口径、宿主适配协议、恢复清单）吸收进 docs/design-decisions.md §3，然后整线删除 evals/ 与评测器、三个 schema、门与清单接线、测试与全部引用。",
  "outcome": "accepted",
  "signals": [
    {
      "kind": "user_feedback_quote",
      "value": "evals删除吧，删除之前先把精华看看能吸收到那个文档里面"
    },
    {
      "kind": "acceptance_output",
      "value": "validate.py all 8×PASS（evals 检查项随装置裁撤移除）；unittest 124→58 全 OK；活面 grep 零残留；protected 覆盖检查 PASS"
    },
    {
      "kind": "measurement",
      "value": "none (method-level change, no instrumented business task)"
    }
  ],
  "claims": [
    {
      "claim_id": "C1",
      "claim": "精华先吸收后删：design-decisions §3 留存 15 用例维度表、八指标与可比条件、宿主适配协议要点（含隔离与观测通道、codex fail-closed）、恢复重建清单",
      "status": "verified",
      "check": "该节为活面唯一评测知识落点；其余处仅存「已裁撤」标注",
      "evidence_ref": "E1"
    },
    {
      "claim_id": "C2",
      "claim": "整线删除：evals/、eval_runner/host_adapter/policy、adapter-protocol、三个 schema + eval-case schema、examples 两组样例；validate.py evals 检查与六项受保护必需集摘除（all 9→8 项）；protected-paths.txt 四条摘除",
      "status": "verified",
      "check": "全量门 8×PASS；protected 覆盖 PASS；目录与脚本在盘消失",
      "evidence_ref": "E1"
    },
    {
      "claim_id": "C3",
      "claim": "测试与引用清收：12 个评测测试类删除（124→58，高于 20 底线）；活文档与角色面引用全量改指；8 条历史记录的 files 条目按契约处置（移除 + 变更记录留痕）",
      "status": "verified",
      "check": "unittest 58 OK；活面 grep 零残留；artifacts PASS",
      "evidence_ref": "E1"
    }
  ],
  "evidence": [
    {
      "evidence_id": "E1",
      "kind": "books",
      "ref": "docs/issues/ISS-2026-10-12-评测装置裁撤.md"
    }
  ],
  "review_roundtrips": [],
  "feedback_summary": "用户拍板删除 evals：知识先吸收（design-decisions §3）再整线删除；方法级改动此后无任何自动回归度量，一律 measurement: none；measurement: none",
  "agentflow_version": "0.10.0",
  "host": "other",
  "provenance": {
    "carrier": "WorkBuddy 会话（主对话直改）",
    "sanitized": true
  },
  "redactions": [],
  "occurred_at": "2026-10-12T18:46:00+08:00"
}
