{
  "schema_version": 1,
  "episode_id": "EP-20260921-001",
  "source_type": "acceptance",
  "revision": {
    "source": "agentflows working tree at git:7a235b5 (0.8.3，本轮未改 skills/agents 本体)；目标仓 aiwork-workflow-ai master@0c4a6cb 新增 docs/features/feature-2026-09-18-定时任务 下 spec/design/plan 九件套 + README 回写（未 commit，两道线下评审门保持未勾）",
    "base": "git:7a235b5 (0.8.3)"
  },
  "run": {
    "run_id": "aiwork-automation-doc-chain-002",
    "started_at": "2026-09-20T21:20:00+08:00",
    "ended_at": "2026-09-21T13:18:00+08:00",
    "status": "complete"
  },
  "objective": "为 aiwork-workflow-ai「定时任务（Automation）」feature 按 agentflow 文档链方法从零重建 spec/fe+be+qa、design/fe+be+qa、plan/fe+be+qa 九件套（proposal 已有）：并行代码事实勘察 → technical-director 跨层决策 → spec 起草+独立评审 → design 起草+独立评审 → plan 起草+独立评审 → doc-chain linter 与目标仓 spec-first 双校验 → README 进度板回写。",
  "outcome": "accepted",
  "signals": [
    { "kind": "method_effect_signal", "value": "【2026-09-21 修订：原判「方法条款目标缺陷零复发」经用户追问与 supervisor 亲读证伪——零复发仅限被点名的实例，缺陷类在表达纪律（流程角色词 TD/supervisor 新变体）、逐行裁决指针（方法条款 vs 目标仓模板冲突无裁决）、契约表形态（linter 存在性检查 vs 拆列标准）三个类上复发，见 ISS-2026-035..038 与 recurrence 台账升级。以下为原判存档：】0.8.3 方法条款（ISS-2026-030~034 固化：契约先核实+契约真源声明、禁自造接口编号与逐行裁决指针、术语写前自查、数据生命周期小节、表达纪律）首次真实运行：评审人按表达纪律检查未报黑话/自造 envelope/编号过载 finding；上轮失败模式（errno 自编、A1-A16 逐行指针、元话语成段）零复发；本轮 findings 集中在不同类别（契约冻结面缺口、CAS 互斥正确性、枚举字面量、DAG 一致性），提示方法条款命中其目标缺陷类", "evidence_ref": "episodes/2026-09-20/EP-20260920-003.json" },
    { "kind": "process_signal", "value": "两个并行 design 起草 agent 因单次生成约千行文档触发模型流中断（no event 900s）且文件未落盘；改为「先写骨架、逐节 Edit 填充、单次 ≤150 行」的增量写盘纪律后两 agent 顺利完成——长文委派任务的写盘协议应进文档链方法", "evidence_ref": "aiwork-automation-doc-chain-002 会话记录" },
    { "kind": "tooling_signal", "value": "目标仓 scripts/spec-first.sh validate 抓出 agentflow doc_chain.py 不检查的相对链接层级错误 5 处（spec/fe→proposal 少一层、design/fe→templates 少一层、plan/qa→design 两处）；双仓校验互补成立；另 spec-first.sh 对中文目录名有 LC_ALL=C perl 字节/字符双编码既有缺陷（对照 feature-2026-09-07-任务体验优化 同样报 7 条 [warn]，exit 0），未改动目标仓工具", "evidence_ref": "aiwork-workflow-ai:scripts/spec-first.sh" },
    { "kind": "review_effect_signal", "value": "独立评审三轮共抓出 3 项设计级实质缺陷：spec 跨文档口径冲突 2 项（异常暂停卡开关反向冻结、失败原因白话枚举四类vs五类）、design 撞车互斥机制不成立（运行期 CAS 无法阻止 manual/scheduled 双路径各建实例，改任务行 FOR UPDATE 临界区）与契约冻结面缺口（FE 已消费 has_active_run/artifacts[] 而 BE 契约未定义）、plan DAG 自引用——作者单方写作均未发现，独立评审门有效", "evidence_ref": "aiwork-automation-doc-chain-002 会话记录" }
  ],
  "review_roundtrips": [
    {
      "at": "2026-09-21T02:30:00+08:00",
      "reviewer": "agentflow:reviewer（spec 三件套·文档模式）",
      "decision": "changes_requested",
      "finding": "阻塞 2：B1 异常暂停卡开关 FE 冻结禁用 vs BE 依低保真图冻结可停用（PRD 状态机无「异常暂停→已停用」边）；B2 配置错误 Run 失败原因 BE 自造第五文案「任务配置已失效」vs FE 冻结四类白话。建议 10（指针失准、尚未产出失实、阻塞级别列缺失等）",
      "resolution": "统一到 PRD 状态机现状（开关禁用）并新增 PRD-BE-07/PRD-FE-07 登记待产品确认；白话枚举统一五类并新增 PRD-BE-08/PRD-FE-08 标注为扩展建议；10 项建议全部修复"
    },
    {
      "at": "2026-09-21T04:10:00+08:00",
      "reviewer": "agentflow:reviewer（spec delta 复审）",
      "decision": "approved",
      "finding": "12 项修复全部核实落实，五类枚举三文件一致、新编号体系无冲突；残留 2 处单 token 措辞瑕疵（QA 条件列「FE-07」未用全称、§0.6 引语漏列 PRD-FE-08）",
      "resolution": "supervisor 按修法直接修复 2 处（PRD-FE-07 正名、引语补全）"
    },
    {
      "at": "2026-09-21T07:20:00+08:00",
      "reviewer": "agentflow:reviewer（design 三件套·design 模式）",
      "decision": "changes_requested",
      "finding": "阻塞 5：BE-01 契约冻结面缺口（FE 已消费 has_active_run/schedule/success_count/chat_title/artifacts[] 而 BE IF-A02/IF-A09/IF-A01 未定义）；BE-02 IF-A06 枚举字面量 'user' 违反自身五值枚举（应 user_paused）；BE-03 撞车互斥不成立（对自身行 CAS 无法阻止 manual/scheduled 双路径各建一实例）；BE-04 删除链漏接 D7 unread 红点清理；BE-05 迁移命名范式与勘察素材冲突未核实未登记。建议 9",
      "resolution": "契约总表补齐字段并声明入口C附件服务端固化；字面量改 user_paused 全表复查；互斥重构为任务行 FOR UPDATE+事务内复判临界区（注明 TiDB 无部分索引）；删除事务补 unread 清理+outbox 失效过滤；supervisor 实测核实迁移双范式（001..050 旧批次+2026-07-28 起时间戳前缀）与 leader.go:65/daemon.go:131-140 行号后冻结口径；建议 9 项全修"
    },
    {
      "at": "2026-09-21T09:40:00+08:00",
      "reviewer": "agentflow:reviewer（design delta 复审）",
      "decision": "changes_requested",
      "finding": "BE-01..05 通过；FE-01 残留 IF-A10 记忆字段 id/content vs fe memory_id/summary 且与自身 DDL summary 列矛盾；FE-02 修复引入清空记忆时机两说（保存前 vs 保存后，保存前有数据丢失风险）；另建议：临界区事务边界两种表述需钉死、API 字段名表述过强、schedule_json 注释缺 start_time",
      "resolution": "supervisor 按复核给定修法直接修复：IF-A10 改 items[]{memory_id,summary,created_at}；清空记忆统一「保存成功后的弹窗收尾内二次确认后调 IF-A11」（be/fe 三处）；事务边界按图定案（额度校验在锁外）；表述与注释按建议修正"
    },
    {
      "at": "2026-09-21T11:30:00+08:00",
      "reviewer": "agentflow:reviewer（plan 三件套·限定范围）",
      "decision": "changes_requested",
      "finding": "阻塞 1：F-01 BE 执行顺序「T02/T03 依赖 T02」字面自引用且与 T03 依赖列、ASCII 小结三处矛盾；FE DAG 并行组（F03∥F04∥F05）与 F05←F03 依赖矛盾、（F11∥F12）与 F12←F11 矛盾。建议 6：注册表漏登 M02-CV-01、SC-38 展开指向 design 内部两说、M05-CV-04 预期 409/400 二选一、关联文档「待产出」失实、行号漂移未注记、QA §3 结构性裁剪未声明",
      "resolution": "BE 统一为 T01→（T02∥T03）→T04 并修 T03 依赖列与 ASCII；FE DAG 重排 F01→F02→F03→（F04∥F05）→F06→（F07∥F08∥F09）→F10→F11→F12 并全表走查依赖列；建议 6 项全修（含 design/qa SC-38 归一 M06-CV-01）"
    },
    {
      "at": "2026-09-21T13:05:00+08:00",
      "reviewer": "agentflow:reviewer（plan delta 复核）",
      "decision": "approved",
      "finding": "7 项修复全部核实落实；BE 依赖列全表走查无环且与三处顺序行一致、FE 依赖列全表走查一致；两条观察项（「依赖 T01」为排期口径措辞、qa-automation-mapping 延后至正式 Plan）判不构成返工",
      "resolution": "无需返工；残余条件（BE V1-V6 与 FE 落点 re-check 原始输出、validate_test_plan.py 留痕）已在 plan 自身门禁中登记为开工前强制项"
    }
  ],
  "claims": [
    { "claim_id": "C1", "claim": "文档链九件套结构完整且通过 agentflow doc-chain linter（含字段级契约表/失败分支时序图/状态机/ER 图/异常矩阵/线框/任务落点/分支策略）", "status": "verified", "check": "python3 tools/lab/doc_chain.py <feature-dir>", "evidence_ref": "输出 PASS doc-chain（修复 C9 落点 9 行后）" },
    { "claim_id": "C2", "claim": "通过目标仓自带 spec-first.sh 结构校验（相对链接层级错误 5 处已修复）", "status": "verified", "check": "./scripts/spec-first.sh validate --path docs/features/feature-2026-09-18-定时任务", "evidence_ref": "输出 [ok] 初始化校验通过，exit=0；[warn] 为既有工具缺陷（对照 feature-2026-09-07 同样 7 条）" },
    { "claim_id": "C3", "claim": "spec/design/plan 三道独立评审门均已收口（每道至少一轮 changes_requested 修复 + delta 复审 approved）", "status": "verified", "check": "reviewer 复审结论逐条核对（本 episode review_roundtrips 6 条）", "evidence_ref": "aiwork-automation-doc-chain-002 会话记录" },
    { "claim_id": "C4", "claim": "写范围仅限目标仓 feature 目录（9 份新文档 + README 回写），业务仓与代码零改动", "status": "verified", "check": "git status --porcelain（目标仓与 agentflows 各查）", "evidence_ref": "目标仓仅 README.md 修改 + 9 个未跟踪新文件；agentflows 零改动" },
    { "claim_id": "C5", "claim": "线下需求评审/技术方案评审两道人类门禁尚未进行，README 中保持未勾且文档状态为草稿", "status": "verified", "check": "README.md 第 3/5 节逐行核对 + 各文档状态行", "evidence_ref": "aiwork-workflow-ai:docs/features/feature-2026-09-18-定时任务/README.md" }
  ],
  "evidence": [
    { "evidence_id": "E1", "kind": "doc_chain_linter", "ref": "aiwork-workflow-ai:docs/features/feature-2026-09-18-定时任务", "digest": "PASS（spec fe350/be409+qa404、design be1007/fe773/qa599、plan be265/fe202/qa493 行，2026-09-21 终版）" },
    { "evidence_id": "E2", "kind": "td_decision_record", "ref": "/tmp/agentflow-dingtask/td-decisions.md", "digest": "D1-D11 全套：automation 域落 safe-agent-nexus、四表+agent_session.source、30s due-scan+leader+fire 唯一键、每 Run 独立隐藏 session 复用 orchestrator、/api/v1/automations* 契约真源 nexus-v1.yaml、unread source_type=automation、GetQuota 触发前校验、capability automation 灰度" },
    { "evidence_id": "E3", "kind": "supervisor_verification", "ref": "nexus migrations/ 与 daemon/leader 源码实测 2026-09-20", "digest": "迁移双范式（001..050 重号旧批次 + 2026-07-28 起时间戳前缀）；util/leader/leader.go 107 行 TryAcquire:65；daemon.go startTickerTask :131-140" }
  ],
  "feedback_summary": "本轮无用户增量反馈（用户仅在两个起草 agent 流中断后指示「继续」）。相对上一轮（EP-20260920-003，6 轮用户纠偏后 outcome=partial、草案被弃）：本轮从零重建并全程通过三道独立评审与双工具校验；0.8.3 方法条款的目标缺陷类零复发，验证方法整合方向有效但样本量为 1，且缺陷形态转移到了方法未覆盖的面（跨文档契约冻结面、并发互斥正确性、DAG 一致性）——后三者提示可评估新增检查项：契约消费方字段反查（FE 消费字段必须在 BE 契约出现）、并发/互斥设计的跨路径推演、plan DAG 与依赖列的程序化一致性检查（本轮 linter C9 抓到落点但未抓 DAG 矛盾，靠评审人走查）。",
  "agentflow_version": "0.8.3",
  "host": "other",
  "provenance": { "carrier": "episodes/2026-09-21/EP-20260921-001.json", "sanitized": true },
  "redactions": [],
  "occurred_at": "2026-09-20T21:20:00+08:00"
}
