{
  "schema_version": 1,
  "episode_id": "EP-2026-10-23-001",
  "source_type": "review",
  "occurred_at": "2026-10-23T03:37:34+08:00",
  "revision": {
    "source": "git:96e0383 + 未提交工作树（发版提交待 T12 落）",
    "base": "git:96e0383"
  },
  "run": {
    "run_id": "batch-feature-2026-10-22-追溯闭环与证据在场",
    "started_at": "2026-10-22T23:30:00+08:00",
    "ended_at": "2026-10-23T03:37:34+08:00",
    "status": "partial"
  },
  "objective": "让目标承接与任务证据变成机器判据（文档链新增 C22、C23），把决策可追溯门的首次采用落到活文件，并收口走查发现的八条文本缺陷；门变更经独立评审后随 0.13.0 发布",
  "outcome": "partial",
  "agentflow_version": "0.13.0",
  "host": "zcode",
  "provenance": {
    "carrier": "本仓方法开发与门维护会话（追溯闭环批），授权来自用户 2026-10-22 当次指示",
    "sanitized": true
  },
  "redactions": [
    "宿主缓存路径与用户名以 ~/ 形式概括，不写个人绝对路径",
    "未复述会话内思考过程，只记断言、命令与结果"
  ],
  "signals": [
    {
      "kind": "measurement",
      "value": "none",
      "evidence_ref": "本批是方法级改动：无仪器化业务对照，按 `docs/design-decisions.md` §3 与 `skills/improve/references/evidence-and-release.md` 的 none 口径记录，不表述为已验证的改进"
    },
    {
      "kind": "gate_change_authorized",
      "value": true,
      "evidence_ref": "用户 2026-10-22 授权「全部授权（C22 + C23 + disposition 进契约 + 门清单同步）」；发版范围选「本地 bump + 快照重建」，领域模板另批"
    },
    {
      "kind": "doc_chain_self_test_cases",
      "value": 106,
      "evidence_ref": "python3.12 tools/lab/doc_chain.py --self-test → 106/106 self-test cases pass（开工基线 85，见 docs/features/feature-2026-10-22-追溯闭环与证据在场/testing/agentflows-gate-evidence/evidence/baseline-96e0383.md）"
    },
    {
      "kind": "unit_tests",
      "value": 92,
      "evidence_ref": "python3 -m unittest discover -s tests → Ran 92 tests OK（基线 78；GoalTraceabilityEvidenceTests 11 例 + ReviewRoundTwoFixTests 3 例）"
    },
    {
      "kind": "gate_item_count",
      "value": 11,
      "evidence_ref": "python3 tools/lab/validate.py --list → all runs 11 checks（项数未增，新判据并入既有 doc_chain/decision_gate 两项；文档已去掉手写计数）"
    },
    {
      "kind": "live_file_adoption",
      "value": "3 个批次目录 + 1 个拍板口 + 16 条 open 记录",
      "evidence_ref": "python3 tools/lab/doc_chain.py --repo . → PASS decision-gate；打标前该命令对同一批数据的 C18 计数为 16（现场记录在 plan/PLAN-TRACE-001.md T07 行证据列）"
    },
    {
      "kind": "independent_review_rounds",
      "value": 2,
      "evidence_ref": "docs/features/feature-2026-10-22-追溯闭环与证据在场/reviews/review-2026-10-23-001.md 与 review-2026-10-23-002.md（两轮均 changes_requested）"
    },
    {
      "kind": "self_found_defects_recorded",
      "value": 3,
      "evidence_ref": "docs/issues/ISS-2026-10-23-元信息同行声明默认落点基准被误判.md、docs/issues/ISS-2026-10-23-变异语料锚点漂移致判据不可观察.md、docs/issues/ISS-2026-10-23-变异存活项长期无逐项处置.md"
    },
    {
      "kind": "gate_semantics_fix_authorized",
      "value": true,
      "evidence_ref": "第二轮评审 P1-1：C17 把核验日解析成当日 00:00，同日提交必然判过期；用户 2026-10-23 授权改日粒度比较，同日不误伤、隔日仍抓"
    }
  ],
  "feedback_summary": "用户要求：按上一轮走查结论立一个 feature、开始修复并升级发版。执行结果：两条新门落地且被证明有判别力（106 例自测、58 项整门变异），决策可追溯门与承接门的采用面首次非零（含把 16 条悬空 open 记录显式登记 deferred、把唯一拍板口改成八列并打标），八条文本缺陷收口，门基线与变异报告从 /tmp 迁到仓内。第一轮独立评审给出 1 条 P0、1 条 P1、11 条 P2：P0（C23 对反引号任务号方言静默失明，导致整条历史批次的证据列从未被读过）与 P1（裸写路径载体不认，与自家规格冲突）均已修并各配夹具与变异项；P2 中的批次集合不一致、出处列未校验、状态聚合单向、decoy 表可绕、装饰表头致判据失效、本仓名仓限定引用无条件放行，逐条修复并补夹具 100–106；编号顺序与「七条/八条」口径不一致是本批自己造出来的，已归位。宿主安装面未切换（用户选择不动宿主），故本 episode 的 outcome 为 partial 而非 complete。",
  "claims": [
    {
      "claim_id": "C1",
      "claim": "文档链新增 C22 目标承接闭环与 C23 证据在场两条判据，且都真的会红（不是空转）",
      "status": "verified",
      "check": "python3.12 tools/lab/doc_chain.py --self-test（用例 86–106）+ 评审者独立夹具在 /tmp 副本逐条打红 + python3.12 tools/lab/mutate.py --check doc_chain_selftest → 17/17 杀死；第二轮评审自建 harness 复验 8 项真修完、2 项带残留",
      "evidence_ref": "docs/features/feature-2026-10-22-追溯闭环与证据在场/reviews/review-2026-10-23-001.md 第一节；plan/PLAN-TRACE-001.md T02/T04 行证据列"
    },
    {
      "claim_id": "C2",
      "claim": "决策门（C15–C18）与本批新门第一次照到活文件",
      "status": "unverified",
      "check": "第二轮评审在冻结提交 861b6ef 上实测 `FAIL decision_gate (1)`：C17 判同日提交为过期，故当时那句「--repo . → PASS」不成立。C17 改日粒度后当前复跑为 PASS——本轮不采信作者自述，标 unverified 待第三轮独立复跑后再升 verified",
      "evidence_ref": "plan/PLAN-TRACE-001.md T07/T08 行证据列；examples/issues/ISS-2026-10-23-开放记录显式延后归属.md 与 examples/invalid/bug-record-disposition-unknown.md"
    },
    {
      "claim_id": "C3",
      "claim": "「已完成」任务的证据从 /tmp 迁到仓内，历史散失证据按契约显式登记而非默默通过",
      "status": "verified",
      "check": "python3.12 tools/lab/doc_chain.py docs/features/feature-2026-10-13-质量提升 与 ...feature-2026-09-19-产品线完善 → 均 PASS；仓内证据目录含门基线与整门变异报告三份文件",
      "evidence_ref": "docs/features/feature-2026-10-22-追溯闭环与证据在场/testing/agentflows-gate-evidence/evidence/（baseline-96e0383.md、mutation-run-2026-10-23.txt、mutation-results-2026-10-23.json）"
    },
    {
      "claim_id": "C4",
      "claim": "门自身可信度可复现：整门变异 58 项，杀死数、存活数、无效数逐项有名",
      "status": "verified",
      "check": "python3.12 tools/lab/mutate.py（一次性 /tmp 副本内运行）→ 报告落盘；无效项为 0（两条漂移锚点已按源码原文回填）；存活项全部登记为 ISS-2026-10-23-变异存活项长期无逐项处置",
      "evidence_ref": "docs/issues/ISS-2026-10-23-变异语料锚点漂移致判据不可观察.md 与 docs/issues/ISS-2026-10-23-变异存活项长期无逐项处置.md 的变更记录"
    },
    {
      "claim_id": "C5",
      "claim": "效果层面「这套方法让交付变好了」没有任何证据，本批不声称",
      "status": "unverified",
      "check": "无仪器化对照可跑（评测装置 2026-10-12 裁撤；用户 2026-10-19 选方案 D 不实现 harness）；`measurement: none` 口径要求把这类改动记为推理 + 事故证据，故 outcome 降为 partial。可跑的近端证据只有门自身信号（自测/变异/采用面），已在 signals 逐条给 ref",
      "evidence_ref": "docs/design-decisions.md §3；docs/features/feature-2026-10-13-质量提升/testing/agentflows-g1-effect/run-2026-10-19-003.md（试跑自述「不构成 G1 结论」）"
    },
    {
      "claim_id": "C6",
      "claim": "0.13.0 已在宿主侧生效（装到的就是这个版本）",
      "status": "unverified",
      "check": "未验证：用户选择「本地 bump + 快照重建」，不动宿主安装。`validate.py installed` 当前为 FAIL（0.12.0 快照与源面漂移，属预期），须在用户重装后复跑并转绿才能升为 verified",
      "evidence_ref": "docs/releases/pending-test.md 第 3 行；packaging/runtime 已由 packaging/build_runtime.py 重建且 `validate.py manifests` PASS"
    },
    {
      "claim_id": "C7",
      "claim": "第一轮独立评审的 P0/P1/P2 全部收口",
      "status": "verified",
      "check": "评审者建议的最小修复逐条落地并各配夹具（100–106）与变异项（M57/M58）；复跑 python3.12 tools/lab/doc_chain.py --self-test → 106/106、三个批次目录模式 PASS、--repo PASS",
      "evidence_ref": "docs/features/feature-2026-10-22-追溯闭环与证据在场/reviews/review-2026-10-23-001.md 第二节处置列；plan/PLAN-TRACE-001.md DEV-05/DEV-06"
    },
    {
      "claim_id": "C8",
      "claim": "跨仓 `--root` 语义与「无 git 环境的失败关闭」在真实宿主上成立",
      "status": "unverified",
      "check": "未运行：手上没有第二个受治理仓可跑 --root 端到端；无 git 环境只在单测里以对象缺失方式覆盖，未在剥掉 PATH 的宿主里实跑 doc_chain.py。记为未运行，不计通过",
      "evidence_ref": "docs/features/feature-2026-10-22-追溯闭环与证据在场/reviews/review-2026-10-23-001.md 第四节残余项"
    },
    {
      "claim_id": "C9",
      "claim": "第二轮评审的 20 条（2 P0 + 4 P1 + 14 P2）已全部落地，且没有靠摘标记或放宽判据转绿",
      "status": "verified",
      "check": "python3 -m unittest discover -s tests → Ran 92 tests OK（含 ReviewRoundTwoFixTests 三项：C17 同日不误伤且隔日仍抓、C18 装饰表头仍解析、无 git 时文案点名原因）；python3 tools/lab/doc_chain.py --self-test → 106/106；三个批次目录模式 PASS；git diff 复核未删除任何标记",
      "evidence_ref": "docs/features/feature-2026-10-22-追溯闭环与证据在场/reviews/review-2026-10-23-002.md 第二节处置列；plan/PLAN-TRACE-001.md DEV-08"
    }
  ],
  "evidence": [
    {
      "evidence_id": "E1",
      "kind": "review",
      "ref": "docs/features/feature-2026-10-22-追溯闭环与证据在场/reviews/review-2026-10-23-001.md（decision changes_requested；1 P0 + 1 P1 + 11 P2）"
    },
    {
      "evidence_id": "E2",
      "kind": "test",
      "ref": "docs/features/feature-2026-10-22-追溯闭环与证据在场/testing/agentflows-gate-evidence/evidence/mutation-results-2026-10-23.json 与同目录 baseline-96e0383.md"
    },
    {
      "evidence_id": "E3",
      "kind": "gate",
      "ref": "tools/lab/doc_chain.py（C22/C23 与归一化）、tools/lab/mutate.py（M52–M58）、schemas/bug-record.schema.json（disposition）、docs/PENDING-DECISIONS.md（八列 + 标记）"
    },
    {
      "evidence_id": "E4",
      "kind": "incident",
      "ref": "docs/issues/ISS-2026-10-23-元信息同行声明默认落点基准被误判.md、ISS-2026-10-23-变异语料锚点漂移致判据不可观察.md、ISS-2026-10-23-变异存活项长期无逐项处置.md"
    }
  ],
  "review_roundtrips": [
    {
      "at": "2026-10-23T00:55:07+08:00",
      "reviewer": "独立 Reviewer 子代理（只读，实验只在 /tmp 副本）",
      "decision": "changes_requested",
      "finding": "P0：C23 的任务号解析不认反引号写法，导致 `feature-2026-09-19-产品线完善` 的 15 行状态行从未被读过，而 G1-AC-05 与拍板口第 11 条把由此得到的 PASS 当成事实依据；P1：裸写路径载体不认，与 spec/be §6.2 直接冲突；P2 十一条含「声明了却不校验」（出处列、表题作用域、状态聚合单向、批次集合两模式不一致、装饰表头即失效、本仓名仓限定引用无条件放行）、本批自己造成的编号顺序倒置与「七条/八条」口径不一、写范围双向不符（5 处未声明 + 3 处声明未改）、以及评审期间工作树被并发改写导致候选未冻结",
      "resolution": "P0/P1 及 P2 的判据类问题逐条修复：任务号与列名统一走 C9 同一归一化、carrier 复用 path_candidates、出处列校验、标题作用域取表、批次集合改遍历全部目录、本仓名引用要求可解析且路径在盘；新增夹具 100–106 与变异 M57/M58 钉住每一条，避免同类盲区再长回来；编号与条数口径归位；写范围双向差异以 DEV-04/DEV-05/DEV-06 入账并把「声明落点 vs 实际改动面进门」登记为下一批方向；由修复多照出的 2 行历史散失证据补仓内载体或 N/A 出处；第二轮评审改在冻结 revision 上复跑",
      "evidence_ref": "docs/features/feature-2026-10-22-追溯闭环与证据在场/reviews/review-2026-10-23-001.md 第二节处置列"
    },
    {
      "at": "2026-10-23T03:37:34+08:00",
      "reviewer": "独立 Reviewer 子代理（只读真实树；/tmp 自建判别 harness，不复用仓内夹具）",
      "decision": "changes_requested",
      "finding": "2 P0 + 4 P1 + 14 P2（共 20 条）。P0：五处载体把「十一项全 PASS」写成事实依据，而冻结提交上 `decision_gate` 实为红；让安装面表述变诚实的 `pending-test` 更正没进被评审的提交，「冻结」不成立。P1：C17 秒级比对使「当天写核验 + 当天推进」数学上不可能绿（G3-AC-04 不可满足）；Q-01 把会话内问答选定写成「用户书面授权」，超过证据强度；G5 要求 `installed` PASS 却与 §1.3 不重装自相矛盾；「七条/八条」口径残留 5 处；P2 第 9 项：反审承接口指错两处；其余 P2：design 四处与代码不一致（批次集合、函数签名、不存在的 `_carrier_present()`、以裸 grep 下 import 存在性结论）、C18 表头未归一化、受保护面清单少报 2 多报 1、§4 自检两条 ☑ 不实、`AGENTS.md:108` 行号被本批挪动、三处 98/98 过时、README 成第三套无人校验的状态载体、docs/features/README.md 复述四类载体又造双源、写范围仍缺 4 个文件入账",
      "resolution": "全修：C17 改日粒度、C18 纳入同一列名归一化、「环境无 git」按承诺写进文案，三项各配回归测试（92 项 OK）；PENDING-DECISIONS 的核验日期语义与 G3-AC-04 改为实况；授权表述降格为「逐字指令 + 会话内问答 + 强度自注」；G5 目标改为「安装面差异如实登记、不冒充通过」；design 与代码逐处对齐、受保护面按实测 5 个列出、§3.2 重写为七步逐条配对；行号引用改按节名、计数统一、载体复述改指针、M-E 回写 ☑ 并把第三套载体登记进 V-01；DEV-08 补 4 个未声明文件。评审者自述的两点方法限制（自跑命令、未独立复现变异）已转记不抹平。",
      "evidence_ref": "docs/features/feature-2026-10-22-追溯闭环与证据在场/reviews/review-2026-10-23-002.md"
    }
  ]
}
