{
  "schema_version": 1,
  "episode_id": "EP-20260918-003",
  "source_type": "user_feedback",
  "objective": "术语歧义判据放宽（0.7.3）：用户澄清「黑话」主形态是惯性压缩词（基线/现网类——人人会用、点头却各解，指代对象因人因时而异），不是发明新词；表达纪律候选的判据据此放宽，修复优先级定为「换 > 释 > 删」并显式写入反过度讲解约束（过度讲解本身按阅读负担计缺陷），同时把三份测量简报的旧口径计数句登记为 S 阶段同步项",
  "outcome": "accepted",
  "signals": [
    {
      "kind": "design_decision",
      "value": "fix priority 换 > 释 > 删 encodes the no-over-explanation constraint",
      "evidence_ref": "替换成具体对象（commit/版本/环境/数值）通常更短、零阅读负担，是首选；一行就地定义只是行话必须保留时的保底；evals/business/README.md 优先级段"
    },
    {
      "kind": "design_decision",
      "value": "variant-② seeds anchor on existing unique fragments, no planting",
      "evidence_ref": "压缩词缺陷在既有文字里，打种引入反而破坏锚点唯一性自查；evals/business/README.md 打种约定术语歧义条"
    },
    {
      "kind": "measurement",
      "value": "brief-counting-rule sync registered as S-phase gate work (deferred)",
      "evidence_ref": "inputs/BT-001/002/003.md 计数句仍为旧口径（「只有作者知道含义的，算问题」），若不同步，压缩词变体种子入测后召回被简报结构性抑制；登记于 PLAN-BUSINESS-EVAL-001 修订 v0.2.5 行，届时按门变更人工评审"
    },
    {
      "kind": "change_surface",
      "value": "4 surfaces: evals/business/README.md + plan revision line + CHANGELOG + manifests; no case/seed/schema/role files",
      "evidence_ref": "评审 C1'/C2' 原始输出确认"
    },
    {
      "kind": "measurement",
      "value": "none (instrument built, not yet run — U-01/U-08 still gate S phase)",
      "evidence_ref": "CHANGELOG 0.7.3 measurement 行"
    }
  ],
  "review_roundtrips": [
    {
      "at": "2026-09-18T07:45:00Z",
      "reviewer": "agentflow:reviewer",
      "decision": "changes_requested",
      "finding": "首轮 delta 重审三条修复：①简报计数句口径与放宽后判据冲突（测量有效性缺口，登记为 S 阶段工作而非当场改）；②计划 updated_at 跨天修订未刷新；③门内文件被误标为「门相关」——protected-paths.txt 对 evals/ 全前缀保护，审计措辞须为「门变更（受保护路径）」",
      "resolution": "三条全部执行并回传 C0'–C6' 原始输出；评审人对未提交 0.7.2 共存与第 5 处 grep 命中（计划行引用计数句原文）作裁定后终裁 approved，附 C7'/C8'/C9' 收口检查。同轮往返亦登记于 EP-20260918-002（会话评审门日志）"
    }
  ],
  "feedback_summary": "用户以「基线、现网其实都是基于什么版本、当前版本或状态、当前实现」校正了黑话问题的主要形态——从发明词转向惯性压缩词。判据放宽落在评测仪器文档与计划修订行；用户同时给出反过度讲解约束，直接塑造了「换 > 释 > 删」优先级。评审门两轮（changes_requested → 修复 → approved），其中评审人自己发现的简报口径缺口是本轮最有价值的发现：判据放宽若不同步测量简报，未来候选的对照数字会失真。",
  "agentflow_version": "0.7.3",
  "host": "other",
  "provenance": {
    "carrier": "zcode-session",
    "sanitized": true
  },
  "redactions": [],
  "occurred_at": "2026-09-18T07:52:00Z"
}
